### ISSUE TITLE
4to6 gateway reservation is not working on testnet

### ISSUE THREAD

**Issue by waleedhammam** [threefoldtech/tfgateway#25]
Reservation: https://explorer.testnet.grid.tf/explorer/reservations/461422

wg:
![image](https://user-images.githubusercontent.com/10658229/84381451-5df09900-abe9-11ea-9409-d5f81137a8bc.png)
![image](https://user-images.githubusercontent.com/10658229/84381480-6517a700-abe9-11ea-9655-5ad51bc911de.png)

ip -6 route:
![image](https://user-images.githubusercontent.com/10658229/84381522-7660b380-abe9-11ea-8cf8-658e4d6eda21.png)

tcp dump:
![image](https://user-images.githubusercontent.com/10658229/84381542-7cef2b00-abe9-11ea-983f-5f80e317fa9e.png)

**Comment by zaibon** [comment]
@waleedhammam you seem to not have any default route for ipv6. You should direct all your ipv6 traffic over the wireguard interface

**Comment by waleedhammam** [comment]
```
root@waleed:/etc/wireguard# ip -6 route show
:: dev wg-461422 metric 1024 pref medium
::1 dev lo proto kernel metric 256 pref medium
fdc7:e007:d95e:9443:decc:8a60:d409:b7cd dev wg-461422 proto kernel metric 256 pref medium
fe80::/64 dev wlp3s0 proto kernel metric 600 pref medium
root@waleed:/etc/wireguard# 
```
done and tcpdump shows that icmp v6 echo request traffic is going through the wg interface

```
15:21:10.714954 IP6 fdc7:e007:d95e:9443:decc:8a60:d409:b7cd > dns.google: ICMP6, echo request, seq 9, length 64
15:21:11.742953 IP6 fdc7:e007:d95e:9443:decc:8a60:d409:b7cd > dns.google: ICMP6, echo request, seq 10, length 64
15:21:12.762941 IP6 fdc7:e007:d95e:9443:decc:8a60:d409:b7cd > dns.google: ICMP6, echo request, seq 11, length 64
```

**Comment by delandtj** [comment]
@waleedhammam can we get through this over telegram ? some interactive hunting would be more efficient

**Comment by m-motawea** [comment]
Thanks @delandtj .the gateway is working fine now.
https://explorer.testnet.grid.tf/explorer/reservations/461473

**Comment by zaibon** [comment]
@delandtj @m-motawea 
What was the issue ?

**Comment by m-motawea** [comment]
I don't know what was the cause. but the traffic wasn't being forwarded by the gateway node.
